<?xml version="1.0" encoding="UTF-8"?>

<xs:schema xmlns:xs="http://www.w3.org/2001/XMLSchema">
    <xs:element name="invoice">
        <xs:complexType>
            <xs:sequence>
                <xs:element name="number">
                    <xs:simpleType>
                        <xs:restriction base="xs:integer">
                            <xs:minInclusive value="1"/>
                        </xs:restriction>
                    </xs:simpleType>
                </xs:element>
                <xs:element name="date" type="xs:date"/>
                <xs:element name="seller">
                    <xs:complexType>
                        <xs:sequence>
                            <xs:element name="name" type="xs:string"/>
                            <xs:element name="address" type="xs:string"/>
                        </xs:sequence>
                    </xs:complexType>
                </xs:element>
                <xs:element name="purchaser">
                    <xs:complexType>
                        <xs:sequence>
                            <xs:element name="name" type="xs:string"/>
                            <xs:element name="address" type="xs:string"/>
                        </xs:sequence>
                    </xs:complexType>
                </xs:element>
                <xs:element name="bill">
                    <xs:complexType>
                        <xs:sequence>
                            <xs:element name="item" maxOccurs="unbounded">
                                <xs:complexType>
                                    <xs:sequence>
                                        <xs:element name="qty">
                                            <xs:simpleType>
                                                <xs:restriction base="xs:integer">
                                                    <xs:minInclusive value="1"/>
                                                </xs:restriction>
                                            </xs:simpleType>
                                        </xs:element>
                                        <xs:element name="description" type="xs:string"/>
                                        <xs:element name="unit_price">
                                            <xs:simpleType>
                                                <xs:restriction base="xs:decimal">
                                                    <xs:minInclusive value="0"/>
                                                </xs:restriction>
                                            </xs:simpleType>
                                        </xs:element>
                                        <xs:element name="amount">
                                            <xs:simpleType>
                                                <xs:restriction base="xs:decimal">
                                                    <xs:minInclusive value="0"/>
                                                </xs:restriction>
                                            </xs:simpleType>
                                        </xs:element>
                                    </xs:sequence>
                                </xs:complexType>
                            </xs:element>

                            <xs:element name="total">
                                <xs:simpleType>
                                    <xs:restriction base="xs:decimal">
                                        <xs:minInclusive value="0"/>
                                    </xs:restriction>
                                </xs:simpleType>
                            </xs:element>

                        </xs:sequence>
                    </xs:complexType>
                </xs:element>
            </xs:sequence>
        </xs:complexType>

    </xs:element>
</xs:schema>